{"$defs":{"criterion":{"additionalProperties":false,"properties":{"comparator":{"enum":["eq","ne","lt","lte","gt","gte","between","contains"]},"evidence_requirement_refs":{"items":{"$ref":"#/$defs/ref"},"maxItems":64,"type":"array","uniqueItems":true},"expected":{"maxLength":1024,"type":["string","number","integer","boolean"]},"falsification":{"type":"boolean"},"id":{"pattern":"^[a-z0-9][a-z0-9._-]{0,127}$","type":"string"},"mandatory":{"type":"boolean"},"observation_class":{"maxLength":128,"minLength":1,"type":"string"},"unit":{"maxLength":64,"minLength":1,"type":"string"}},"required":["id","observation_class","comparator","expected","unit","mandatory","falsification"],"type":"object"},"digest":{"pattern":"^[a-f0-9]{64}$","type":"string"},"document_schema":{"additionalProperties":false,"properties":{"id":{"const":"https://agent-ops.ru/schemas/foundation_outcome_check.schema.json"},"media_type":{"const":"application/schema+json"},"sha256":{"$ref":"#/$defs/digest"},"version":{"const":"1.0.0"}},"required":["id","version","sha256","media_type"],"type":"object"},"ref":{"additionalProperties":false,"properties":{"id":{"maxLength":128,"minLength":1,"type":"string"},"kind":{"enum":["project","environment","service","owner","tool_contract","evidence_record","evidence_bundle","operational_intent","human_decision","outcome_check"]},"namespace":{"maxLength":512,"minLength":8,"type":"string"},"version":{"maxLength":32,"pattern":"^(0|[1-9][0-9]*)\\.(0|[1-9][0-9]*)\\.(0|[1-9][0-9]*)$","type":"string"}},"required":["kind","namespace","id","version"],"type":"object"},"risk":{"additionalProperties":false,"properties":{"blocking":{"type":"boolean"},"description":{"maxLength":1024,"minLength":1,"type":"string"},"id":{"pattern":"^[a-z0-9][a-z0-9._-]{0,127}$","type":"string"}},"required":["id","description","blocking"],"type":"object"},"time_window":{"additionalProperties":false,"properties":{"end":{"format":"date-time","type":"string"},"start":{"format":"date-time","type":"string"}},"required":["start","end"],"type":"object"}},"$id":"https://agent-ops.ru/schemas/foundation_outcome_check.schema.json","$schema":"https://json-schema.org/draft/2020-12/schema","additionalProperties":false,"properties":{"criteria":{"items":{"$ref":"#/$defs/criterion"},"maxItems":64,"minItems":1,"type":"array"},"decision_ref":{"$ref":"#/$defs/ref"},"document_schema":{"$ref":"#/$defs/document_schema"},"evaluation_time":{"format":"date-time","type":"string"},"evaluation_window":{"$ref":"#/$defs/time_window"},"evidence_refs":{"items":{"$ref":"#/$defs/ref"},"maxItems":256,"type":"array","uniqueItems":true},"format_version":{"const":"1.0.0"},"intent_ref":{"$ref":"#/$defs/ref"},"owner_ref":{"$ref":"#/$defs/ref"},"ref":{"$ref":"#/$defs/ref"},"residual_risks":{"items":{"$ref":"#/$defs/risk"},"maxItems":128,"type":"array"},"snapshot_ref":{"$ref":"#/$defs/ref"}},"required":["format_version","document_schema","ref","owner_ref","intent_ref","snapshot_ref","decision_ref","evaluation_time","evaluation_window","criteria","evidence_refs","residual_risks"],"title":"Gitinsky Foundation Outcome Check Input Document","type":"object"}
